{
  "innsigle": "1",
  "type": "https://innsigle.dev/claim/colophon/v1",
  "issued_at": "2026-07-29T21:00:27Z",
  "issuer": {
    "id": "azgaard-dogfood",
    "name": "Azgaard Sample",
    "key_id": "ed25519:56a6f2f799318d5153b3ba9b5e955d3b",
    "key_url": "https://documentdrivendx.github.io/innsigle/sample/.well-known/innsigle/keys.json"
  },
  "subjects": [
    {
      "digest": {
        "alg": "sha256",
        "value": "75131986332cde83302d180513c8464d84ccea97e1853f11ebdde091f209f869"
      }
    }
  ],
  "colophon": {
    "schema_version": "1",
    "composition": "model-primary",
    "ingredients": [
      {
        "kind": "model",
        "name": "Claude",
        "role": "draft"
      },
      {
        "kind": "tool",
        "name": "sloptimizer",
        "role": "rewrite"
      },
      {
        "kind": "human",
        "name": "operator",
        "role": "structure-edit"
      }
    ],
    "notes": "Sample page for Innsigle UC-AI-docs"
  }
}
