{
  "innsigle": "1",
  "type": "https://innsigle.dev/claim/colophon/v1",
  "issued_at": "2026-07-22T12:00:00Z",
  "issuer": {
    "id": "azgaard-test",
    "name": "Azgaard Test",
    "key_id": "ed25519:cd89509bfdc9b5cf0df4e462517b59eb",
    "key_url": "https://example.com/.well-known/innsigle/keys.json"
  },
  "subjects": [
    {
      "uri": "https://example.com/vectors/sample.html",
      "digest": {
        "alg": "sha256",
        "value": "29a52c20b5016aaac3c1be05fca72f572966f3ffbe1bd7156eb1fca50b73adbc"
      }
    }
  ],
  "colophon": {
    "schema_version": "1",
    "composition": "model-primary",
    "ingredients": [
      {
        "kind": "model",
        "name": "Claude",
        "role": "draft"
      },
      {
        "kind": "human",
        "name": "operator",
        "role": "prompter-reviewer"
      }
    ],
    "notes": null,
    "human_input": {
      "method": "hi1",
      "basis": "session-journal",
      "percent": 48,
      "weights": {
        "direction": 25,
        "contribution": 40,
        "review": 35
      },
      "direction": {
        "percent": 100,
        "user_prompts": 3,
        "model_write_bursts": 3
      },
      "contribution": {
        "percent": 0,
        "human_chars": 0,
        "model_chars": 812,
        "human_write_events": 0,
        "coverage": "full"
      },
      "review": {
        "percent": 67,
        "post_output_prompts": 2,
        "review_events": 0
      }
    }
  }
}
