{
  "innsigle": "1",
  "type": "https://innsigle.dev/claim/colophon/v1",
  "issued_at": "2026-07-22T12:00:00Z",
  "issuer": {
    "id": "azgaard-test",
    "name": "Azgaard Test",
    "key_id": "ed25519:02ba9ce3c4c385cfae5f6bf75bfa3cb7",
    "key_url": "https://example.com/.well-known/innsigle/keys.json"
  },
  "subjects": [
    {
      "uri": "https://example.com/vectors/sample.html",
      "digest": {
        "alg": "sha256",
        "value": "29a52c20b5016aaac3c1be05fca72f572966f3ffbe1bd7156eb1fca50b73adbc"
      }
    }
  ],
  "colophon": {
    "schema_version": "1",
    "composition": "model-primary",
    "ingredients": [
      {
        "kind": "model",
        "name": "Claude",
        "role": "draft"
      },
      {
        "kind": "tool",
        "name": "sloptimizer",
        "role": "rewrite"
      },
      {
        "kind": "human",
        "name": "operator",
        "role": "structure-edit"
      }
    ],
    "notes": null
  }
}
